{
  "id": "biga-pizza",
  "name": "100% Biga Pizza Dough",
  "description": "Slow-fermented pizza dough with 100% biga pre-ferment and long cold fermentation. Flavorful, easy to digest, open crumb.",
  "source": "https://youtube.com",
  "favorite": true,
  "baseYield": {
    "amount": 6,
    "unit": "dough balls",
    "weightPerUnit": {
      "min": 250,
      "max": 260
    }
  },
  "ingredientGroups": [
    {
      "name": "Biga",
      "phase": "biga-prep",
      "items": [
        {
          "name": "Bread flour",
          "amount": 1000,
          "unit": "g",
          "scalable": true,
          "notes": "Caputo Nuvola Super or Caputo Pizzeria, 12-13% protein"
        },
        {
          "name": "Water",
          "amount": 450,
          "unit": "ml",
          "scalable": true,
          "notes": "Room temperature"
        },
        {
          "name": "Instant yeast",
          "amount": 2,
          "unit": "g",
          "scalable": true
        }
      ]
    },
    {
      "name": "Main dough",
      "phase": "main-dough",
      "items": [
        {
          "name": "Water",
          "amount": 200,
          "unit": "ml",
          "scalable": true,
          "notes": "Room temperature"
        },
        {
          "name": "Salt",
          "amount": 20,
          "unit": "g",
          "scalable": true
        },
        {
          "name": "Instant yeast",
          "amount": 1.5,
          "unit": "g",
          "scalable": true
        }
      ]
    }
  ],
  "phases": [
    {
      "id": "biga-prep",
      "name": "Prepare Biga",
      "steps": [
        {
          "id": "biga-mix",
          "name": "Mix Biga",
          "emoji": "🍕",
          "type": "active",
          "duration": {
            "min": 15,
            "ideal": 20,
            "max": 25
          },
          "dependsOn": null,
          "alarm": {
            "enabled": true,
            "offsetMinutes": 0
          },
          "description": "{{ingredient:Bread flour}} flour and {{ingredient:Instant yeast}} instant yeast into a dough box.\nPour {{ingredient:Water}} water over the flour.\nClose the lid and shake vigorously until biga strands form.\nTransfer to a bowl with a lid.",
          "flexPriority": 1,
          "unsocialHours": {
            "canOverlap": false,
            "mustAvoid": true
          }
        },
        {
          "id": "biga-bulk",
          "name": "Bulk fermentation at room temperature",
          "emoji": "⏳",
          "type": "passive",
          "duration": {
            "min": 90,
            "ideal": 120,
            "max": 150
          },
          "dependsOn": "biga-mix",
          "alarm": {
            "enabled": false,
            "offsetMinutes": 0
          },
          "description": "Leave the biga covered at room temperature.",
          "flexPriority": 7,
          "unsocialHours": {
            "canOverlap": true,
            "mustAvoid": false
          }
        },
        {
          "id": "biga-fridge",
          "name": "Into the refrigerator",
          "emoji": "🧊",
          "type": "active",
          "duration": {
            "min": 3,
            "ideal": 5,
            "max": 5
          },
          "dependsOn": "biga-bulk",
          "alarm": {
            "enabled": true,
            "offsetMinutes": -5
          },
          "description": "Place the biga in the refrigerator.\n±2h tolerance for the cold fermentation.",
          "flexPriority": 1,
          "unsocialHours": {
            "canOverlap": false,
            "mustAvoid": true
          }
        },
        {
          "id": "cold-ferment",
          "name": "Cold fermentation",
          "emoji": "🧊",
          "type": "passive",
          "duration": {
            "min": 2280,
            "ideal": 2760,
            "max": 3000
          },
          "dependsOn": "biga-fridge",
          "alarm": {
            "enabled": false,
            "offsetMinutes": 0
          },
          "description": "Cold fermentation in the refrigerator. 44-48h ideal, 38-50h acceptable.",
          "flexPriority": 10,
          "unsocialHours": {
            "canOverlap": true,
            "mustAvoid": false
          }
        }
      ]
    },
    {
      "id": "main-dough",
      "name": "Main dough",
      "steps": [
        {
          "id": "biga-out",
          "name": "Take biga out",
          "emoji": "🍕",
          "type": "active",
          "duration": {
            "min": 15,
            "ideal": 30,
            "max": 30
          },
          "dependsOn": "cold-ferment",
          "alarm": {
            "enabled": true,
            "offsetMinutes": 0
          },
          "description": "Take the biga out of the refrigerator and let it acclimatize.\n\nWhile waiting, prepare:\n- Dissolve {{ingredient:Salt}} salt in {{ingredient:Water}} water\n- Dissolve {{ingredient:Instant yeast}} instant yeast in a little water",
          "flexPriority": 5,
          "unsocialHours": {
            "canOverlap": false,
            "mustAvoid": true
          }
        },
        {
          "id": "knead",
          "name": "Knead main dough",
          "emoji": "🍕",
          "type": "active",
          "duration": {
            "min": 30,
            "ideal": 40,
            "max": 45
          },
          "dependsOn": "biga-out",
          "alarm": {
            "enabled": true,
            "offsetMinutes": 0
          },
          "description": "Break the biga into pieces.\nAdd yeast water to the biga, low speed.\nGradually work in the remaining water including the salt water.\nKnead until smooth and elastic (8-10 min).\n\nALWAYS incorporate yeast before the salt water!",
          "flexPriority": 1,
          "unsocialHours": {
            "canOverlap": false,
            "mustAvoid": true
          }
        },
        {
          "id": "main-bulk",
          "name": "Bulk fermentation",
          "emoji": "⏳",
          "type": "passive",
          "duration": {
            "min": 50,
            "ideal": 60,
            "max": 75
          },
          "dependsOn": "knead",
          "alarm": {
            "enabled": false,
            "offsetMinutes": 0
          },
          "description": "Cover the dough and let it rest at room temperature.",
          "flexPriority": 5,
          "unsocialHours": {
            "canOverlap": false,
            "mustAvoid": false
          }
        },
        {
          "id": "shape",
          "name": "Shape dough balls",
          "emoji": "🍕",
          "type": "active",
          "duration": {
            "min": 20,
            "ideal": 30,
            "max": 40
          },
          "dependsOn": "main-bulk",
          "alarm": {
            "enabled": true,
            "offsetMinutes": 0
          },
          "description": "With oiled hands, remove the dough from the bowl.\nShape {{yield:amount}} dough balls of {{yield:weightPerUnit}} g each.\nForm into smooth rounds and place on a floured tray.",
          "flexPriority": 2,
          "unsocialHours": {
            "canOverlap": false,
            "mustAvoid": true
          }
        },
        {
          "id": "final-proof",
          "name": "Final proof",
          "emoji": "⏳",
          "type": "passive",
          "duration": {
            "min": 90,
            "ideal": 120,
            "max": 150
          },
          "dependsOn": "shape",
          "alarm": {
            "enabled": false,
            "offsetMinutes": 0
          },
          "description": "Let the dough balls proof at room temperature.",
          "flexPriority": 6,
          "unsocialHours": {
            "canOverlap": false,
            "mustAvoid": false
          }
        },
        {
          "id": "preheat",
          "name": "Preheat oven",
          "emoji": "🔥",
          "type": "active",
          "duration": {
            "min": 30,
            "ideal": 45,
            "max": 60
          },
          "dependsOn": "shape",
          "gapAfterPrevious": {
            "min": 45,
            "ideal": 75,
            "max": 110
          },
          "alarm": {
            "enabled": true,
            "offsetMinutes": 0
          },
          "description": "Preheat the oven now!\nAt least 30-45 minutes.",
          "flexPriority": 3,
          "unsocialHours": {
            "canOverlap": false,
            "mustAvoid": true
          }
        },
        {
          "id": "bake",
          "name": "Bake",
          "emoji": "🍕🔥",
          "type": "active",
          "duration": {
            "min": 20,
            "ideal": 30,
            "max": 45
          },
          "dependsOn": "final-proof",
          "alarm": {
            "enabled": true,
            "offsetMinutes": 0
          },
          "description": "Stretch the dough balls, add toppings, and bake.\n\nEnjoy!",
          "flexPriority": 1,
          "unsocialHours": {
            "canOverlap": false,
            "mustAvoid": true
          }
        }
      ]
    }
  ],
  "surplus": {
    "enabled": true,
    "options": [
      {
        "id": "fridge",
        "name": "Refrigerator",
        "description": "Place shaped dough balls covered into the refrigerator.",
        "shelfLife": {
          "days": 2,
          "qualityNotes": "Day 1: nearly identical. Day 2: noticeable but good — dough becomes flatter and less elastic."
        },
        "reactivationSteps": [
          {
            "id": "surplus-fridge-out",
            "name": "Take dough balls out of refrigerator",
            "emoji": "🍕",
            "type": "passive",
            "duration": {
              "min": 90,
              "ideal": 120,
              "max": 150
            },
            "dependsOn": null,
            "description": "Take the dough balls out of the refrigerator and let them come to room temperature.",
            "alarm": {
              "enabled": true,
              "offsetMinutes": 0
            }
          },
          {